{
  "schema_version": "lift-roi-evidence.v1",
  "evidence_id": "aaaaaaaa-aaaa-4aaa-8aaa-aaaaaaaaaaaa",
  "timestamp": "2026-06-11T12:10:00+09:00",
  "source": "tb3_1_picam",
  "robot_id": "tb3_1",
  "frame_id": "tb3_1_pi_camera_optical_frame",
  "operation": "PICKUP",
  "task_id": "TASK-IN-0001",
  "image": {"width": 640, "height": 480},
  "roi": {
    "roi_id": "TB3_1_LIFT_ROI",
    "kind": "LIFT",
    "polygon_xy": [[220, 180], [420, 180], [440, 360], [200, 360]]
  },
  "expected_count": 2,
  "stable_frames": 5,
  "count_stable": true,
  "lift_sensor": {
    "lift_up": true,
    "lift_down_complete": null,
    "backoff_complete": null
  },
  "load": {
    "count": 2,
    "empty": false,
    "accepted_items": [
      {
        "class_name": "box",
        "bbox_xyxy": [240, 210, 310, 290],
        "confidence": 0.91,
        "track_id": "box-1",
        "evidence_type": "bbox",
        "mask_area_px": null,
        "center_inside_roi": true,
        "overlap_ratio": 0.98,
        "reason": "accepted"
      },
      {
        "class_name": "box",
        "bbox_xyxy": [330, 215, 395, 295],
        "confidence": 0.88,
        "track_id": "box-2",
        "evidence_type": "instance_mask",
        "mask_area_px": 4100,
        "center_inside_roi": true,
        "overlap_ratio": 0.94,
        "reason": "accepted"
      }
    ],
    "rejected_items": [
      {
        "class_name": "unknown",
        "bbox_xyxy": [30, 40, 80, 100],
        "confidence": 0.52,
        "track_id": null,
        "evidence_type": "bbox",
        "mask_area_px": null,
        "center_inside_roi": false,
        "overlap_ratio": 0.0,
        "reason": "class_not_load"
      }
    ]
  },
  "dropped_item_count": 0,
  "verification": {
    "status": "CONFIRMED",
    "reason": "pickup_verified"
  },
  "policy": {
    "policy_version": "mvp1-lift-roi",
    "load_classes": ["box", "pallet"],
    "min_confidence": 0.5,
    "min_overlap_ratio": 0.6
  },
  "metadata": {
    "model": "mock-yolo-seg",
    "latency_ms": 14.2
  }
}
